{
  "$schema": "./schema.json",
  "basics": {
    "name": "jean",
    "label": "dev fullstack",
    "image": "https://avatars.githubusercontent.com/u/173914591?v=4",
    "email": "jeanribeiro1905@gmail.com",
    "summary": "Olá! Meu nome é Jean, trabalho com front tem 4 anos. Comecei na área de tecnologia com UX/UI mais focado em UI e com o tempo fui me aproximando do frontend onde desenvolvia páginas sempre focado em estar condizente com a UI proposta. Sou curioso e sempre aceito um desafio, gosto de fazer telas bonitas e me inspiro muito em jogos (vide meu portfolio :p). Gosto bastante de ler, principalmente fantasias e ficção científica. ",
    "heroGifUrl": "https://media.giphy.com/media/EjJgeEVUCfuTe/giphy.gif",
    "location": {
      "city": "Varginha",
      "region": "MG"
    },
    "profiles": [
      {
        "network": "GitHub",
        "url": "https://github.com/jeanribeir01"
      },
      {
        "network": "LinkedIn",
        "url": "https://linkedin.com/in/jeanribeir0/"
      },
      {
        "network": "Twitter",
        "url": "https://x.com/jeanribeir01"
      }
    ]
  },
  "skills": [
    "React",
    "Next.js",
    "TypeScript",
    "Tailwind CSS",
    "HTML5",
    "CSS3",
    "Node.js",
    "Python",
    "PostgreSQL",
    "Docker",
    "GitHub Actions",
    "Linux",
    "Nginx",
    "Git",
    "VS Code",
    "Figma"
  ],
  "projects": [
    {
      "name": "algorithms-exercises",
      "url": "https://github.com/jeanribeir01/algorithms-exercises"
    },
    {
      "name": "viu",
      "url": "https://github.com/jeanribeir01/viu"
    },
    {
      "name": "ponto-de-partida",
      "url": "https://github.com/jeanribeir01/ponto-de-partida"
    },
    {
      "name": "gestao-hogwarts",
      "url": "https://github.com/jeanribeir01/gestao-hogwarts"
    },
    {
      "name": "batalha-rpg",
      "url": "https://github.com/jeanribeir01/batalha-rpg"
    }
  ],
  "education": [
    {
      "institution": "Grupo Unis",
      "area": "Engenharia de Software",
      "studyType": "Bacharelado",
      "startDate": "2025-02",
      "endDate": ""
    }
  ],
  "work": [
    {
      "name": "Tech Solutions Inc",
      "position": "Desenvolvedor Full Stack",
      "url": "https://techsolutions.com",
      "startDate": "2024-06",
      "endDate": "",
      "summary": "Desenvolvimento de aplicações web escaláveis usando React e Node.js. Colaboração em equipe ágil com sprints quinzenais.",
      "highlights": [
        "Implementou sistema de notificações em tempo real",
        "Reduziu tempo de carregamento em 40% com otimizações",
        "Mentoria de 2 desenvolvedores júnior"
      ]
    },
    {
      "name": "Startup XYZ",
      "position": "Estagiário de Desenvolvimento",
      "url": "https://startupxyz.com",
      "startDate": "2023-06",
      "endDate": "2024-05",
      "summary": "Desenvolvimento de features frontend e integração com APIs. Participação ativa em code reviews e planejamento técnico.",
      "highlights": [
        "Desenvolveu 15+ componentes reutilizáveis",
        "Implementou sistema de autenticação OAuth2",
        "Automatizou deploy com GitHub Actions"
      ]
    }
  ],
  "config": {
    "starterPokemon": "charmander",
    "showFooterCredit": true
  }
}
